titlebodytag"3 Necessary Tools for the High Rolling Affiliate Marketer","What does it take to become a successful Affiliate Marketer? What are the ingredients of an affiliate marketing success story? Is there a shortcut to Affiliate Marketing glory? All these questions play around in the minds of affiliate marketers who want to make it big in this business. 
Although affiliate marketing is touted as one of the easiest and most effective ways to earn money online, it is not as easy as it sounds. The wise affiliate marketer plans every action and executes it the best way he can. He should also maximize the potential to earn by utilizing the right tools necessary for a successful Affiliate Marketing business. We have consulted some of the most successful affiliate marketers in the business and below are the top three necessary tools for a successful affiliate marketing business.

Important Tool #1: Your Own Website

The most important and indispensable tool in Affiliate Marketing is your own website. The first step in any successful affiliate marketing business is building a good, credible and professional looking website. Your website is the jump off point of all your marketing efforts. Thus, you must first build a user-friendly website, which will appeal to your prospects and encourage them to click on the links to the products and service you are promoting and make a purchase. Therefore, you must first concentrate your efforts in building a website that will cater to what your prospects need. 

The most important thing you should consider is that almost all web users go online to look for information, not necessarily to go and buy something. Above all else, make your website full of original, relevant and useful content. People will love articles that are appealing and helpful. Keep in mind that, in the internet, content is still king and good quality content will not only build your credibility, it can also help you achieve a higher search engine ranking. By posting relevant and useful articles, you establish yourself as a credible expert in the field, making you a more trustworthy endorser of the product or service you promote. Establishing a good reputation is a good step in building up a loyal consumer base.

Important Tool #2: Incentives

Competition is extremely tight in the internet world. You must always be one-step ahead of your rivals to ensure that you capture a significant share of your target market. Therefore, you must use every possible means to encourage people not only to visit your site but also to click and proceed to the websites of the products and services you are promoting. Building an opt-in email list is one of the best ways to gather prospects. Offer a newsletter or an e-zine. Better yet, offer incentives to your prospects to encourage them to subscribe to your newsletters. You can present free softwares, access to exclusive services and other freebies that will be helpful to your prospects.

Important Tool #3: Link Popularity

The importance of driving highly targeted traffic to your website cannot be emphasized enough. The all-important web traffic is at the top of the list of the most important entities in the internet world. Attracting people to your site should be the first step you should carry out. Do everything to achieve a high search engine ranking. Link Popularity is one of the factors that search engines use to determine search engine rankings. Therefore, to enhance your link popularity, you must launch an aggressive reciprocal link campaign.

One of the best ways to do this – at no cost at all – is by submitting articles, with your website's link at the resource box, to e-zines and free article sites. You will not only gain exposure, you will also have the opportunity to advertise for free, just include a link back to your site. The more sites you submit your articles to, the better your link popularity is. Make your articles original, relevant and useful so that more websites will pick it up and post it.

These are but three of the many tools that an affiliate marketer can use to maximize earning potential. The possibilities are endless and are limited only by your imagination, creativity, resourcefulness and determination. You can always explore other ideas and adapt other strategies, which you think might help you become a high rolling affiliate marketer.","test2","5 Things You Must Have to Succeed in Affiliate Marketing","The idea of being mere passengers on a ship meant to sail to the farthest points does not appeal to people who like to put their destiny into their own hands.  They have the desire of maneuvering the ships themselves, of being able to be the ones to take it anywhere they want to.  Being aboard a ship on its way to a particularly great destination is something each and every one of them dreams of, and the knowledge that they have the capacity to steer it themselves is what makes them actually want to.

Perhaps this is the reason why more and more people are succumbing to one of the most popular businesses around – affiliate marketing.  It is because in this business, there are no bosses to order the employees around.  There are no deadlines to meet and no clutter of work do to.  One only needs to be equipped with the tools needed to succeed in a business such as this, and he is bound to get what his heart ultimately desires.

Just what are the things needed to be able to succeed in affiliate marketing?  What must one have within himself to be able to do well in this industry?  There is a lot of competition involved in affiliate marketing, and to be able to rise above the norm, one must be equipped with just the right stuff necessary to propel him forward.  There are five things one must ultimately possess if he wants to achieve the glory he is yearning for in this business, and these five things are a must for him to possess to be able to stand out among the rest.

The very first quality one must possess if he wants to try his hand in affiliate marketing is the willingness to learn and be trained.  Treading through unfamiliar territory is scary stuff if one is not properly equipped, and he might get lost amidst a jungle of the unknown.  Learning the tricks of the trade is also an important aspect of the game, and one’s willingness to know it all will give him far better advantages in the business than he could ever imagine.

The second quality one must possess is the willingness to invest time and effort even if direct results do not seem at all apparent.  Although several months may pass without good news, it is important for one who has his foot in the industry to hold on and wait.  It is this quality which would save him from giving up after investing a lot of himself in the business.

The third quality one must possess is self-determination.  If one wants to conquer the affiliate marketing world, he must have the ability to push himself ahead.  Never having to say die is a quality each and every affiliate marketer should possess, and the ability to motivate oneself into scaling greater heights is an ability which would actually take an affiliate marketer there.

The fourth quality one must possess is discipline.  If one knows how to teach himself to work everyday with all the energy he can muster, then he is close to achieving what he has set his heart to having in the first place.

The fifth and last quality one must possess is optimism.  Negative attitudes and hearsays should not discourage an affiliate marketer from pursuing what he has to in order to make life better for himself and for everyone concerned.  Neither should anyone influence his attitude toward the business, because once in it, it is a must for him to be the captain of his ship and the master of his soul.

The ingredients to success in a business such as affiliate marketing are diverse and manifold, but the most important thing one needs to be able to make it big lies in himself alone.  It is he who has the capacity to do everything to be able to realize his prospects, and the desire which fuels his heart in doing so is the gasoline which should keep the engine going.

Affiliate marketing is all about putting one’s fate into his own hands.  The right attitude is the key to being able to steer one’s ship into that part of the ocean where a certain kind of serenity can be found, one that permeates the atmosphere as the ship sails calmly on.","test2","7 Ways to Drive Laser-Targeted Traffic","An affiliate marketer may have all the things needed for him to be able to succeed in a business such as affiliate marketing.  He may have the necessary drive, diligence and perseverance to be able to understand how the system works.  He may have all the tools necessary in maintaining the business, including a really unique and interesting website which could earn him a fortune if only the whole world could see it.  However, all these would prove useless if he does not know how to drive traffic to his website.  His business would sink into oblivion together with all the sales, fortune and dreams that he might have realized if he only knew how to do this particular task.

Getting people who matter to see one’s website is a difficult undertaking if he tries to consider the fact that there are rivals everywhere waiting to pin him down.  The immensity of the internet as well as the affiliate marketing world has given birth to the fierce competition between affiliate marketers, each of whom has his own great product to offer.  With all the websites piling on top of each other, how would one be able to stand out?  The seven best ways to drive laser-targeted traffic to one’s own website would help those who are bent on sticking it out with this business wherever it is bound to take them.

The first step in driving traffic to one’s website is by relying on search engines and what they can do for the affiliate marketer concerned.  Because they are popular for driving free targeted traffic, they should not be ignored by all means.  Having top search engine rankings is vital in building popularity links, and the use of the right keywords is important in attaining this goal.  Once a website is on top of the list, it is easily accessible to anyone who wants to see it for himself.

The second way in driving traffic to one’s website is by contacting other webmasters for a possible link exchange partnership.  Locating websites that are related to one’s own website is the primary task.  Once there, he should be able to establish communication by personalizing everything as much as possible.  It is then possible to make reciprocal link exchanges between webmasters whichever way the affiliate marketer prefers.

The third way is through writing one’s own articles.  This is an effective way in promoting a website, because good content that are appreciated by readers will lead them to visit the writer’s very own website out of sheer interest.

The fourth way is through joint venture marketing.  This is one of the most effective ways of promoting a product or a service.  Having a partner through ad swap or link exchange is beneficial to both parties as it allows them to reach a wide customer base in a short amount of time.

The fifth is through joining affiliate programs.  Having affiliates to do the work means allowing them to bring tons of traffic to a website.  Skyrocketing sales would be realized as a result, and both the affiliate and the website owner will benefit from the situation.

The sixth is by having a list of subscribers that one can refer to every so often, because they are those which would prove to be valuable assets for the marketer concerned.  The use of autoresponders and personalized newsletters is one way of keeping track of them all, and holding on to them by letting them know about new products and services is an essential task that should be done by the affiliate marketer concerned.

The seventh is by knowing one’s market through and through.  It is important for traffic to be targeted to those who might have a special interest in the theme or topic of one’s website.  This way, a solid customer base is going to be created.  Once a potential customer shows an interest in a particular website by paying it a visit, one must not waste time in trying to show him that his effort is worth it.

Traffic generating strategies are important in trying to make one’s affiliate marketing career inch forward.  It is always advantageous to plan one’s moves in any business that he might undertake.  This is particularly so in affiliate marketing.  If one knows how to get people to see what he has to offer, then he is on the right track.","test2",